What are the most common use cases for Amazon Translate?,"Amazon Translate is a great solution in cases where the volume of content is high, speed is critical, and a certain level of translation imperfection (usually minor) is acceptable. For example, if you need to extract insights from large volumes of text in many languages, enable customers to search your application in their language of choice, make user-authored content such as forums and support content accessible in languages other than the source, get the gist out of responses to questionnaires and surveys, or publish a first draft ? you can use Amazon Translate?s raw output. With light human post-editing, Amazon Translate can be applied to enabling customer service agents to support anyone, and translating company authored information such as specifications, comparisons of alternatives, FAQs, and support content. With more extensive post-editing, you can also use Amazon Translate to translate high-value, branded content, such as advertising and marketing materials, contracts, etc.  "
How can I use the service?,"The easiest way to get started with Amazon Translate is to use the console to translate some text. You can also call the service directly from the AWS Command Line Interface, or use one of the SDKs in the programming language of your choice to integrate with your applications. Either way, you can start using Amazon Translate for multilingual text capabilities to translate text with just a few lines of code. You can pass source text to the API and indicate the source and target languages. Amazon Translate return the text translated into the target language. There are three main ways to use the API ? first, you can integrate the API into your application to localize highly dynamic application components such as multi-participant chat, for example. Second, you can string it with other services to enable language-independent processing. For example, Database services such as Amazon Relational Database Service (RDS) can be called through AWS Lambda blueprints to enable website localization of moderately-dynamic content such as user generated reviews and forum posts. Finally, you can translate batches of documents. For example, financial services companies can translate and monitor news articles in any language; legal teams can discover materials in multiple languages related to a lawsuit (known as eDiscovery); patent attorneys can search patent repositories anywhere in the world in IP cases."
Does the service provide automatic source language detection?,"A: Amazon Translate takes plain text input and language flags to indicate the language of the source text and desired target. If the source language is unknown, Amazon Translate will identify the source language using Amazon Comprehend behind the scenes, and report that language back along with the translation to the target language."
What kind of inputs does the service support?,Amazon Translate supports plain text input in UTF-8 format.
What are the limits on the API??,"Amazon Translate real-time service calls are limited to 5,000 bytes per API call. We provide instructions on how to break up large documents into sections and paragraphs so that customers can translate text of any length. See instructions here. Amazon Translate asynchronous Batch Translation service accepts a batch of up to 5 GB in size per API call with each document not exceeding 1 MB in size and the number of documents in the S3 bucket folder not exceeding 1 million per batch.

The Amazon Translate service is highly scalable. The default limits can be found here."
Am I required to attribute the translation to Amazon? To Machine Translation??,"You are not required to attribute translations, but we do suggest that you attribute the translation to Machine Translation to inform your own customers."
Where can I get technical support? How do I submit feedback??,"For technical support, please contact AWS Customer Service. You can submit feedback through Customer Service, or by going to the Amazon Translate console and selecting the feedback option."
What does it cost?,Refer to the Amazon Translate pricing page to learn more.
What AWS regions are available for Amazon Translate?,"Please refer to the AWS Global Infrastructure Region Table. Amazon Translate Batch Translation is available in US East 1 (Northern Virginia), US East 2 (Ohio), US West 2 (Oregon), EU West 1 (Ireland), EU West 2 (London), EU Central 1 (Frankfurt), and Asia Pacific North East 2 (Seoul)."
?Are requests in which no translation occurs charged for?,"Requests where the source language equals the target language (whether user designated or automatically identified), and when an error occurs and no translation is returned, are not charged for. Requests where the content is non-translatable (e.g., ?&*^%((**&(^?) are charged for."
"Are text inputs processed by Amazon Translate stored, and how are they used by AWS?","Amazon Translate may store and use text inputs processed by the service solely to provide and maintain the service and to improve and develop the quality of Amazon Translate and other Amazon machine-learning/artificial-intelligence technologies. Use of your content is important for continuous improvement of your Amazon Translate customer experience, including the development and training of related technologies. We do not use any personally identifiable information that may be contained in your content to target products, services or marketing to you or your end users. Your trust, privacy, and the security of your content are our highest priority, and we implement appropriate and sophisticated technical and physical controls, including encryption at rest and in transit, designed to prevent unauthorized access to, or disclosure of, your content and ensure that our use complies with our commitments to you. Please see https://aws.amazon.com/compliance/data-privacy-faq/ for more information."
Who has access to my content that is processed and stored by Amazon Translate?,"Only authorized employees will have access to your content that is processed by Amazon Translate. Your trust, privacy, and the security of your content are our highest priority and we implement appropriate and sophisticated technical and physical controls, including encryption at rest and in transit, designed to prevent unauthorized access to, or disclosure of, your content and ensure that our use complies with our commitments to you. Please see https://aws.amazon.com/compliance/data-privacy-faq/ for more information."
Do I still own my content that is processed and stored by Amazon Translate,"You always retain ownership of your content, and we will only use your content with your consent."
Is the content processed by Amazon Translate moved outside the AWS region where I am using Amazon Translate?,"Any content processed by Amazon Translate is encrypted and stored at rest in the AWS region where you are using Amazon Translate. Some portion of content processed by Amazon Translate may be stored in another AWS region solely in connection with the continuous improvement and development of your Amazon Translate customer experience and other Amazon machine-learning/artificial-intelligence technologies. Your trust, privacy, and the security of your content are our highest priority, and we implement appropriate and sophisticated technical and physical controls, including encryption at rest and in transit, designed to prevent unauthorized access to, or disclosure of, your content and ensure that our use complies with our commitments to you. Please see https://aws.amazon.com/compliance/data-privacy-faq/ for more information."
"Can I use Amazon Translate in connection with websites, programs or other applications that are directed or targeted to children under age 13 and subject to the Children?s Online Privacy Protection Act (COPPA)?","Yes, subject to your compliance with the AWS Service Terms, including your obligation to provide any required notices and obtain any required verifiable parental consent under COPPA, you may use Amazon Translate in connection with websites, programs, or other applications that are directed or targeted, in whole or in part, to children under age 13."
"How do I determine whether my website, program, or application is subject to COPPA?","For information about the requirements of COPPA and guidance for determining whether your website, program, or other application is subject to COPPA, please refer directly to the resources provided and maintained by the United States Federal Trade Commission. This site also contains information regarding how to determine whether a service is directed or targeted, in whole or in part, to children under age 13."
What is Natural Language Processing?,"Natural Language Processing (NLP) is a way for computers to analyze, understand, and derive meaning from textual information in a smart and useful way. By utilizing NLP, you can extract important phrases, sentiment, syntax, key entities such as brand, date, location, person, etc., and the language of the text."
What is Amazon Comprehend?,Amazon Comprehend is a natural language processing (NLP) service that uses machine learning to find meaning and insights in text.
What can I do with Amazon Comprehend?,"You can use Amazon Comprehend to identify the language of the text, extract key phrases, places, people, brands, or events, understand sentiment about products or services, and identify the main topics from a library of documents. The source of this text could be web pages, social media feeds, emails, or articles. You can also feed Amazon Comprehend a set of text documents, and it will identify topics (or group of words) that best represent the information in the collection. The output from Amazon Comprehend can be used to understand customer feedback, provide a better search experience through search filters and uses topics to categorize documents. ?"
How do I get started with Amazon Comprehend?,You can get started with Amazon Comprehend from the AWS console. Your free tier for 12 months starts from the time you submit your first request. See product documentation on how to use Amazon Comprehend APIs in your application.
What are the most common use cases of Amazon Comprehend?,"The most common use cases include:

Voice of customer analytics: You can gauge whether customer sentiment is positive, neutral, negative, or mixed based on the feedback you receive via support calls, emails, social media, and other online channels.

Semantic search: You can use Amazon Comprehend to provide a better search experience by enabling your search engine to index key phrases, entities, and sentiment. This enables you to focus the search on the intent and the context of the articles instead of basic keywords.  

Knowledge management and discovery: You can analyze a collection of documents and automatically organize them by topic. You can then use the topics to personalize content for your customers."
Do I have to be a natural language processing expert to use Amazon Comprehend?,"No, you don?t need NLP expertise to use Amazon Comprehend. You only need to call Amazon Comprehend?s API, and the service will handle the machine learning required to extract the relevant data from the text."
Is Amazon Comprehend a managed service?,"Amazon Comprehend is a fully managed and continuously trained service, so you don?t have to manage the scaling of resources, maintenance of code, or maintaining the training data."
Does Amazon Comprehend learn over time?,"Yes, Amazon Comprehend uses machine learning is continuously being trained to make it better for your use cases."
In which AWS regions in Amazon Comprehend available?,"For a list of the supported Amazon Comprehend AWS regions, please visit the AWS Region Table for all AWS global infrastructure. Also for more information, see Regions and Endpoints in the AWS General Reference."
What security measures does Amazon Comprehend have?,Requests to the Amazon Comprehend API and console are made over a secure (SSL) connection. You can use AWS Identity and Access Management (AWS IAM) to control which IAM users have access to specific Amazon Comprehend actions and resources.
Where do I store my data?,"You can use user Amazon Comprehend to read your data from Amazon S3. You can also write the results from Amazon Comprehend to a storage service, database, or data warehouse."
How do I know if the service can process my data?,"For text analysis APIs, you will receive an HTTP status code of 200 indicating successful processing. If your data can't be processed or exceeds service limits, you will get an appropriate HTTP error code."
How do I know if Amazon Comprehend is giving accurate results?,"The service will return a confidence score for each result. Low confidence scores mean that the service?s confidence is low that it is correct. Conversely, if the service is highly confident, the score will be closer to 1."
Can I import or use my own NLP model with Amazon Comprehend?,"No. At the current time, Comprehend does not support custom models."
How is Amazon Comprehend priced?,Refer to the Amazon Comprehend pricing page to learn more about pricing tiers and discounts.
"Are text inputs processed by Amazon Comprehend stored, and how are they used by AWS?","Amazon Comprehend may store and use text inputs processed by the service solely to provide and maintain the service and to develop and improve the quality of Amazon Comprehend and other Amazon machine-learning/artificial-intelligence?technologies. This does not apply to Amazon Comprehend Medical. Use of your content is important for continuous improvement of your Amazon Comprehend customer experience, including the development and training of related technologies. We do not use any personally identifiable information that may be contained in your content to target products, services or marketing to you or your end users. Your trust, privacy, and the security of your content are our highest priority and we implement appropriate and sophisticated technical and physical controls, including encryption at rest and in transit, designed to prevent unauthorized access to, or disclosure of, your content and ensure that our use complies with our commitments to you. Please see?https://aws.amazon.com/compliance/data-privacy-faq/?for more information."
Who has access to my content that is processed and stored by Amazon Comprehend?,"Only authorized employees will have access to your content that is processed by Amazon Comprehend. Your trust, privacy, and the security of your content are our highest priority and we implement appropriate and sophisticated technical and physical controls, including encryption at rest and in transit, designed to prevent unauthorized access to, or disclosure of, your content and ensure that our use complies with our commitments to you. Please see the AWS data privacy FAQs for more information."
Do I still own my content that is processed and stored by Amazon Comprehend?,You always retain ownership of your content and we will only use your content with your consent.
Is the content processed by Amazon Comprehend moved outside the AWS region where I am using Amazon Comprehend?,"Any content processed by Amazon Comprehend is encrypted and stored at rest in the AWS region where you are using Amazon Comprehend. Some portion of content processed by Amazon Comprehend may be stored in another AWS region solely in connection with the continuous improvement and development of your Amazon Comprehend customer experience and other Amazon machine-learning/artificial-intelligence?technologies. This does not apply Amazon Comprehend Medical. Your trust, privacy, and the security of your content are our highest priority and we implement appropriate and sophisticated technical and physical controls, including encryption at rest and in transit, designed to prevent unauthorized access to, or disclosure of, your content and ensure that our use complies with our commitments to you. Please see the?https://aws.amazon.com/compliance/data-privacy-faq/?for more information."
"Can I use Amazon Comprehend in connection with websites, programs or other applications that are directed or targeted to children under age 13 and subject to the Children?s Online Privacy Protection Act (COPPA)?","Yes, subject to your compliance with the Amazon Comprehend Service Terms, including your obligation to provide any required notices and obtain any required verifiable parental consent under COPPA, you may use Amazon Comprehend in connection with websites, programs, or other applications that are directed or targeted, in whole or in part, to children under age 13."
"How do I determine whether my website, program, or application is subject to COPPA?","For information about the requirements of COPPA and guidance for determining whether your website, program, or other application is subject to COPPA, please refer directly to the resources provided and maintained by the United States Federal Trade Commission. This site also contains information regarding how to determine whether a service is directed or targeted, in whole or in part, to children under age 13."
What is Amazon Comprehend Medical?,"Amazon Comprehend Medical is a natural language processing service that makes it easy to use machine learning to extract relevant medical information from unstructured text. Using Amazon Comprehend Medical, you can quickly and accurately gather information, such as medical condition, medication, dosage, strength, and frequency from a variety of sources, like doctors? notes, clinical trial reports, and patient health records."
What can I do with Amazon Comprehend Medical?,"Amazon Comprehend Medical uses advanced machine learning models to accurately and quickly identify medical information such as medical conditions, and medication, and determine their relationship to each other, for instance, medication and dosage. You access Comprehend Medical through a simple API call, no machine learning expertise is required, no complicated rules to write, and no models to train. You can use the extracted medical information and their relationships to build applications for use cases, like clinical decision support, revenue cycle management (medical coding), and clinical trial management. Because Comprehend Medical is HIPAA eligible and can quickly identify protected health information (PHI), such as name, age, and medical record number, you can also use it to create applications that securely process, maintain, and transmit PHI.

Please note. When using Amazon Comprehend Medical to identify protected health information, please recall that the service provides confidence scores that indicate the level of confidence in the accuracy of the extracted entities. You should evaluate these confidence scores and identify the right confidence threshold for your use case. For specific compliance use cases, we recommend you use additional human review or other methods to confirm the accuracy of extracted PHI."
How do I get started with Amazon Comprehend Medical? ,You can get started with Amazon Comprehend Medical from the AWS Management console or using the SDK. Refer to this technical documentaton page for details. Amazon Comprehend Medical provides a free tier so you can test out the service. Refer to this pricing page.?
Do I have to be a natural language processing (NLP) expert to use Amazon Comprehend Medical?,"No, you don?t need NLP expertise to use Amazon Comprehend Medical. You only need to call Amazon Comprehend?s API, and the service will handle the machine learning required to extract the relevant data from the text."
Does Amazon Comprehend Medical learn over time?,"Yes, Amazon Comprehend uses machine learning and is continuously being trained to make it better for customer use cases. Amazon Comprehend Medical does not use customer data used with the service to train the models."
?In which AWS regions in Amazon Comprehend Medical available?,"For a list of the supported Amazon Comprehend AWS regions, please visit the AWS Region Table for all AWS global infrastructure."
What else should I know before using the Amazon Comprehend Medical service?,"Amazon Comprehend Medical is not a substitute for professional medical advice, diagnosis, or treatment. You and your end users are responsible for exercising your and their own discretion, experience, and judgment in determining the correctness, completeness, timeliness, and suitability of any information provided by Amazon Comprehend Medical. You and your end users are solely responsible for any decisions, advice, actions, and/or inactions based on the use of Amazon Comprehend Medical.

Amazon Comprehend Medical may not accurately identify protected health information in all circumstances, and does not meet the requirements for de-identification of protected health information in accordance with HIPAA. You are responsible for reviewing any output provided by Amazon Comprehend Medical to ensure it meets your needs."
How is Amazon Comprehend Medical priced?,Refer to the Amazon Comprehend Medical pricing page to learn more about pricing tiers.
Is the content processed by Amazon Comprehend Medical used for any purpose other than to provide and maintain the service?,"Amazon Comprehend Medical does not use content processed by the service for any reason other than to provide and maintain the service. Content processed by the service is not used to develop or improve the quality of Amazon Comprehend Medical or other Amazon machine-learning/artificial-intelligence technologies, and will not be stored in any AWS region other than the region in which you are using the service. You always retain ownership of your content and we will only use your content with your consent."
"Can I use Amazon Comprehend Medical in connection with websites, programs or other applications that are directed or targeted to children under age 13 and subject to the Children?s Online Privacy Protection Act (COPPA)?","Yes, subject to your compliance with the Amazon Comprehend Medical Service Terms, including your obligation to provide any required notices and obtain any required verifiable parental consent under COPPA, you may use Amazon Comprehend Medical in connection with websites, programs, or other applications that are directed or targeted, in whole or in part, to children under age 13"
"How do I determine whether my website, program, or application is subject to COPPA?","For information about the requirements of COPPA and guidance for determining whether your website, program, or other application is subject to COPPA, please refer directly to the resources provided and maintained by the United States Federal Trade Commission. This site also contains information regarding how to determine whether a service is directed or targeted, in whole or in part, to children under age 13."
What is Amazon Lex?,"Amazon Lex is a service for building conversational interfaces using voice and text. Powered by the same conversational engine as Alexa, Amazon Lex provides high quality speech recognition and language understanding capabilities, enabling addition of sophisticated, natural language ?chatbots? to new and existing applications. Amazon Lex reduces multi-platform development effort, allowing you to easily publish your speech or text chatbots to mobile devices and multiple chat services, like Facebook Messenger, Slack, Kik, or Twilio SMS. Native interoperability with AWS Lambda, AWS MobileHub and Amazon CloudWatch and easy integration with many other services on the AWS platform including Amazon Cognito, and Amazon DynamoDB makes bot development effortless."
How can I get started with Amazon Lex? ,"To start using Amazon Lex, simply sign into the AWS Management Console and navigate to ?Lex? under the ?Artificial Intelligence? category. You must have an Amazon Web Services account to start using Amazon Lex. If you do not already have one, you will be prompted to create one during the sign-up process. Please refer to the Amazon Lex Getting Started Guide for more information."
What are the most common use cases for Amazon Lex?," The most common use-cases include:

    Informational bot ? build an automated customer support agent or bot that answers questions
    Application/Transactional bot ? build a stand-alone pizza ordering agent or a travel bot
    Enterprise Productivity bot ? build custom bots to connect to enterprise data resources
    Device Control bot? use Amazon Lex to issue control commands to connected devices"
How does Amazon Lex work with other AWS services?,"Amazon Lex leverages AWS Lambda for Intent fulfillment, Amazon Cognito for user authentication, and Amazon Polly for text to speech. In addition, AWS Mobile Hub can be used to automatically provision bots from a template."
Do I have to be a machine learning expert to use Amazon Lex?,No machine learning expertise is necessary to use Amazon Lex. Developers can declaratively specify the conversation flow and Amazon Lex will take care of the speech recognition and natural language understanding functionality. Developers provide some sample utterances in plain English and the different parameters (slots) that they would like to collect from their user with the corresponding prompts. The language model gets built automatically.
In which AWS regions is Amazon Lex available?,"For a list of the supported Amazon Lex AWS regions, please visit the AWS Region Table for all AWS global infrastructure. Also for more information, see Regions and Endpoints in the AWS General Reference."
What is the maximum bandwidth supported on Amazon Lex? ,Amazon Lex scales to your needs and does not impose bandwidth constraints.
