Is Amazon Lex a managed service?,Amazon Lex is a completely managed service so you don?t have to manage scaling of resources or maintenance of code. Your interaction schema and language models are automatically backed up. We also provide comprehensive versioning capability for easy rollback. Amazon Lex architecture does not require storage or backups of end user data.
When do I use Amazon Polly vs. Amazon Lex?,Amazon Polly converts text inputs to speech. Amazon Lex is a service for building conversational interfaces using voice and text.
Does Amazon Lex get more intelligent over time?,Yes. Amazon Lex uses deep learning to improve over time.
"I was in the Amazon Lex preview program. &nbsp;Now that Amazon Lex is GA, what happens to my account?","On April 19, 2017, Amazon Web Services announced that Amazon Lex exited Preview and entered General Availability. As such, we will be terminating the Amazon Lex Preview Program on May 1, 2017. Usage will be charged as per the pricing plan starting May 1st. Your first 12 months for the free tier will start on May 1st. Please note that Amazon Lex is now supported under Developer Support, Business Support and Enterprise Support plans. You can also post your queries on the public Amazon Lex forums."
How do I create a bot in Amazon Lex?,"To create a bot, you will first define the actions performed by the bot. These actions are the intents that need to be fulfilled by the bot. For each intent, you will add sample utterances and slots. Utterances are phrases that invoke the intent. Slots are input data required to fulfill the intent. Lastly, you will provide the business logic necessary to execute the action. An Amazon Lex bot can be created both via Console and REST APIs."
Can I implement business logic on the client?,Yes. Amazon Lex provides the option of returning parsed intent and slots back to the client for business logic implementation.
How can I validate user input? ,"Amazon Lex provides deep integration with AWS Lambda and you can validate user input using the initialization and validation codeHook. This code gets executed at every turn of the conversation. The codehook can be used to set up session parameters, validate user input and customize responses."
What is an Intent? ,"To build an Amazon Lex bot, you will need to identify a set of actions - known as 'intents? -- that you want your bot to fulfill. A bot can have multiple intents. For example, a ?BookTickets? bot can have intents to make reservations, cancel reservations and review reservations."
What is an utterance? ,"An ?utterance? is the spoken or typed phrase to invoke an intent. For example, to invoke the intent to make reservations, you would provide a sample utterance such as, ?Can I make a reservation??"
What are slots? ,"To fulfill an intent, the Amazon Lex bot needs information from the user. This information is captured in ?slots?. For example, you would define show name and time as slots for intent to make reservations."
What are prompts? ,"Amazon Lex elicits the defined ?slots? by using the ?prompts? provided. For example, to elicit value for the slot ?time? you will define a prompt such as ?What show time would you like to reserve??. Amazon Lex is capable of eliciting multiple slot values via a multi-turn conversation."
How is an action fulfilled?,"Amazon Lex integrates with AWS Lambda for ?fulfillment? of the action or business logic. Alternately, you can configure Amazon Lex to return parsed intent and slot values to the client for action fulfillment."
How do I monitor and track my bot? ,"You can track metrics for your bot on the ?Monitoring? dashboard in the Amazon Lex Console. Currently, you can track the number of missed utterances, request latency and traffic by channel for your bot. You can view list of utterances that were not recognized by your bot, aka 'missed utterances'. With these monitoring capabilities, you view how your users are interacting with the bot and make improvements over time."
What happens when I ?build? a bot?,Building a bot triggers machine learning and creates the models for your bot. A new version of your intents and slot types is created. Once created a version is immutable.
How can I test an Amazon Lex bot?,You can test your Amazon Lex bot via the test window on the console. &nbsp;Any business logic implemented in AWS Lambda can be tested via this console as well. All supported browsers allow for testing text with your Amazon Lex bot; voice can be tested from a Chrome browser.
How can I create Amazon Lex bots for mobile?,"Amazon Lex provides SDKs for iOS and Android. You can develop bots for your mobile use cases with these SDKs. User authentication can be enabled via Amazon Cognito. You can use AWS Mobile Hub to build, test and monitor bots for your mobile platforms. AWS Mobile Hub can be used to automatically provision Amazon Lex bots from a template."
How can I make Amazon Lex bots available on messaging services?,"Amazon Lex bots can be published to messaging platforms like Facebook Messenger, Slack, Kik, and Twilio SMS. To publish the bot you can provide the tokens for authentication in the console, and we will store it securely and provide a callback URL that you can provide to the chat service."
Do I have to submit my bot for certification prior to deployment?,You don?t need to certify your bot with Amazon prior to deployment.
Can I have an Amazon Lex bot version deployed for use by end users while I continue to develop on a different version?,"Yes. You can build and deploy a version of your bot into production while you continue to develop on a different version. Every version of an Amazon Lex bot will have an ARN. Each version can be associated with a different alias. You can use these tools to set up dev, stage and prod environments"
Can I choose different versions while deploying to different messaging services?,"Yes. You can deploy a specific version to each messaging service. Every version of Amazon Lex will have an ARN. Each version can be associated with an alias. You can use different aliases for deployment to different messaging service. Also, you can have multiple bots deployed to the same messaging service."
What is the maximum duration of speech input?,Amazon Lex supports up to 15 seconds of speech input.
Can I configure for speech input and text output?,"Yes, you can just choose the PostContent API to provide voice input and choose text output."
How many languages are supported on Amazon Lex?,"Currently, Amazon Lex supports US English."
What audio formats does Amazon Lex support?,"Amazon Lex supports the following formats for input audio: LPCM and Opus; Supported output audio formats: MPEG, OGG, PCM."
Can I use Amazon Lex in VPC?,"Amazon Lex can be accessed from VPC via public endpoints for building and running a bot. Currently, Amazon Lex does not provide a VPC endpoint."
Can I access Amazon Lex bots locally i.e. without an Internet connection?,No. End users will need to access the Amazon Lex runtime endpoint over the Internet.
How is this different from Alexa Skills Kit?,"Alexa Skills Kit (ASK) is used to build skills for use in the Alexa ecosystem and devices and lets developers take advantage of all Alexa capabilities such as the Smart Home and Flash Briefing API, streaming audio and rich GUI experiences. Amazon Lex bots support both voice and text and can be deployed across mobile and messaging platforms."
Do I need a wake word to invoke an Amazon Lex intent?,"Amazon Lex does not support wake word functionality. The app that integrates with Amazon Lex will be responsible for triggering the microphone, i.e. push to talk."
Can an Amazon Lex bot respond using Alexa?s voice?,"Currently we do not support the Alexa voice for Amazon Lex responses. However, there are 7 other voices from which to choose."
Can I create an Alexa Skill from an Amazon Lex bot?,"Amazon Lex provides the ability for you to export your Amazon Lex bot schema into a JSON file that is compatible with Amazon Alexa. Once downloaded as JSON, you need to log in to the Alexa developer portal, navigate to the ?Interaction Model? tab, launch the Alexa Skill Builder, and paste the bot schema into the Code Editor of your Alexa Skill.&nbsp; More details and steps can be found in the Amazon Lex documentation."
"When exporting my Amazon Lex bot schema to use in an Alexa skill, are my AWS Lambda functions exported and included in the bot schema?",No. Only the bot definition will be downloaded.
I have created an Alexa Skill from an Amazon Lex bot using the schema export feature. Which Alexa platforms support the Amazon Lex bot schema?,"All Alexa platforms that support Alexa skills can be used: The Amazon Echo, Amazon Dot, Amazon Look, Amazon Tap, Amazon Echo Show and any third-party Alexa-enabled devices."
"Are voice and text inputs processed by Amazon Lex stored, and how are they used by AWS?","Amazon Lex may store and use voice and text inputs processed by the service solely to provide and maintain the service and to improve and develop the quality of Amazon Lex and other Amazon machine-learning/artificial-intelligence technologies. Use of your content is necessary for continuous improvement of your Amazon Lex customer experience, including the development and training of related technologies. We do not use any personally identifiable information that may be contained in your content to target products, services or marketing to you or your end users. Your trust, privacy, and the security of your content are our highest priority and we implement appropriate and sophisticated technical and physical controls, including encryption at rest and in transit, designed to prevent unauthorized access to, or disclosure of, your content and ensure that our use complies with our commitments to you. Please see https://aws.amazon.com/compliance/data-privacy-faq/ for more information."
Can I delete voice and text inputs stored by Amazon Lex?,Yes. You can request deletion of voice and text inputs associated with your account by contacting AWS Support. Deleting voice and text inputs may degrade your Amazon Lex experience.
Who has access to my content that is processed and stored by Amazon Lex?,"Only authorized employees will have access to your content that is processed by Amazon Lex. Your trust, privacy, and the security of your content are our highest priority and we implement appropriate and sophisticated technical and physical controls, including encryption at rest and in transit, designed to prevent unauthorized access to, or disclosure of, your content and ensure that our use complies with our commitments to you. Please see?https://aws.amazon.com/compliance/data-privacy-faq/ for more information."
Do I still own my content that is processed and stored by Amazon Lex?,You always retain ownership of your content and we will only use your content with your consent.
"Can I use Amazon Lex in connection with websites, programs or other applications that are directed or targeted to children under age 13 and subject to the Children?s Online Privacy Protection Act (COPPA)?","Yes, subject to your compliance with the Amazon Lex Service Terms, including your obligation to provide any required notices and obtain any required verifiable parental consent under COPPA, you may use Amazon Lex in connection with websites, programs, or other applications that are directed or targeted, in whole or in part, to children under age 13. Amazon Lex does not store or retain voice or text utterance information from websites, programs, or applications that are identified by customers in accordance with the Amazon Lex Service Terms as being directed or targeted, in whole or in part, to children under age 13 and subject to COPPA."
"How do I determine whether my website, program, or application is subject to COPPA?","For information about the requirements of COPPA and guidance for determining whether your website, program, or other application is subject to COPPA, please refer directly to the resources provided and maintained by the United States Federal Trade Commission. This site also contains information regarding how to determine whether a service is directed or targeted, in whole or in part, to children under age 13. whole or in part, to children under age 13."
What SDKs are supported for Amazon Lex?,"Amazon Lex currently supports SDKs for runtime services. IoS and Android SDKs, as well as Java, JS, Python, CLI, .Net, Ruby, PHP, Go, and CPP support both text and speech input."
Can I use SDKs to build bots?,"You can build bots using SDKs: Java, JavaScript, Python, CLI, .NET, Ruby on Rails, PHP, Go, and CPP."
Which enterprise connectors are supported on Amazon Lex?,"Amazon Lex integrates with enterprise connectors via AWS Lambda. The following enterprise connectors can be provisioned via AWS Mobile Hub: Salesforce, Microsoft Dynamics, Marketo, Zendesk, Quickbooks, and HubSpot."
What support is provided for Amazon Lex?,"Depending on your AWS support contract, Amazon Lex is supported under Developer Support, Business Support and Enterprise Support plans. &nbsp;You can also post your queries on the Amazon Lex forums."
How does Amazon Lex count the number of requests?,"Every input to an Amazon Lex bot is counted as a request. For example, if an end user provides 5 inputs to the bot as part of conversation, these are billed as 5 requests. Usage is metered and billed per request."
How much does Amazon Lex cost?,It is free to get started. Please see Amazon Lex Pricing Page for current pricing information.
Does Amazon Lex participate in the AWS Free Tier?,"Yes. You can try Amazon Lex for free. From the date you get started with Amazon Lex, you can process up to 10,000 text requests and 5,000 speech requests per month for free during the first year."
"I was in the Amazon Lex preview program. Now that Amazon Lex is GA, what happens to my account?","On April 19, 2017, Amazon Web Services announced that Amazon Lex exited Preview and entered General Availability. As such, we will be terminating the Amazon Lex Preview Program on May 1, 2017. Usage will be charged as per the pricing plan starting May 1st. Your first 12 months for the free tier will start on May 1st. Please note that Amazon Lex is now supported under Developer Support, Business Support and Enterprise Support plans. You can also post your queries on the public Amazon Lex forums."
What is Amazon Transcribe?,"Amazon Transcribe is an AWS service that makes it easy for customers to convert speech-to-text. Using Automatic Speech Recognition (ASR) technology, customers can choose to use?Amazon Transcribe for a variety of business applications, including transcription of voice-based customer service calls, generation of subtitles on audio/video content, and conduct (text based) content analysis on audio/video content. ?"
How does Amazon Transcribe interact with other AWS products?,"Amazon Transcribe converts audio input into text, which opens the door for various text analytics applications on voice input. For instance, by using Amazon Comprehend on the converted text data from Amazon Transcribe, customers can perform sentiment analysis or extract entities and key phrases. Similarly, by integrating with Amazon Translate and Amazon Polly, customers can accept voice input in one language, translate it into another and generate voice output, effectively enabling multi-lingual conversations. It is also possible to integrate Amazon Transcribe with Amazon Elasticsearch to index and perform text based search across audio/video library.?"
What else should I know before using Amazon Transcribe service?,"Amazon Transcribe service is designed to handle a wide range of speech and acoustic characteristics, including variations in volume, pitch, and speaking rate. The quality and content of the audio signal (including but not limited to factors such as background noise, overlapping speakers, accented speech, or switches between languages within a single audio file) may affect the accuracy of service output. We are constantly updating the service to improve its ability to accommodate additional acoustic variation and content types.?"
How will developers access Transcribe?,"The easiest way to get started with Amazon Transcribe is to submit a job using the console to transcribe an audio file. You can also call the service directly from the AWS Command Line Interface, or use one of the supported SDKs of your choice to integrate with your applications. Either way, you can start using Amazon Transcribe to generate automated transcripts for your audio files with just a few lines of code."
What kind of inputs does Amazon Transcribe support?,"Amazon Transcribe supports both 16 kHz and 8kHz audio streams, and multiple audio encodings, including WAV, MP3, MP4 and FLAC."
Does Amazon Transcribe support real-time transcriptions?,Yes. Amazon Transcribe enables users to open a bidirectional stream over HTTP2. Users can send an audio stream to the service while receiving a text stream in return in real time. ?
What encoding does real-time transcription support?,Streaming transcription currently supports 16-bit Linear PCM encoding.?
What languages does Amazon Transcribe support?,"For information on language support, please refer to this documentation page.?"
What devices does Amazon Transcribe work with?,"Amazon Transcribe for the most part is device agnostic. In general, Amazon Transcribe works with any device that includes an on-device microphone such as phones, PCs, tablets, and IoT devices (e.g. car audio systems). Amazon Transcribe API will be able to detect the quality of the audio stream being input at the device (8kHz VS 16kHz) and will appropriately select the acoustic models for converting speech-to-text. Furthermore, developers can call Transcribe API through their applications to access speech-to-text conversion capability.?"
Are there size restrictions on the audio content that Amazon Transcribe can process?,Amazon Transcribe service calls are limited to 4 hours (or 2GB) per API call for our batch service. The streaming service can accommodate open connections up to 4 hours long.?
What programming languages does Amazon Transcribe support?,"Amazon Transcribe batch service supports .NET, Go, Java, Javascript, PHP, Python and Ruby. Amazon Transcribe real-time service supports Java SDK, Ruby SDK, and C++ SDK. Additional SDK support are coming. For more details, visit the Resources page."
My custom vocabulary words are not being recognized! What can I do?,"The speech recognition output depends on a number of factors in addition to custom vocabulary entries, so there can be no assurance that if a term is included in the custom vocabulary, it will be correctly recognized. However, the most frequent reason is that a custom word lacks the correct pronunciation. If you haven?t provided a pronunciation for your custom word, please try to create one. If you already have provided one, double-check its correctness, or include other pronunciation variants if necessary. This can be done by creating multiple entries in the custom vocabulary file that differ in the pronunciation field."
Why do I see too many custom words in my output?,"Custom vocabularies are optimized for a small list of targeted words; larger vocabularies may lead to over-generation of custom words, especially when they contain words that are pronounced in a similar way. If you have a large list, please try reducing it to rare words and words that are actually expected to occur in your audio files. If you have a large vocabulary covering multiple use cases, split it into separate lists for different use cases. The words that are short and sound similar to many other words, may lead to over-generation (too many custom words appearing in the output). It is preferable to combine these words with surrounding words and list them as hyphen-separated phrases. For example, the custom word ?A.D.? could be included as part of a phrase such as ?A.D.-converter?."
"There are two ways of giving pronunciations, IPA or SoundsLike fields in the custom vocabulary table. Which one is better?","IPA allows for more precise pronunciations. You should provide IPA pronunciations if you are able to generate IPA (e.g., from a lexicon that has IPA pronunciations or an online converter tool)."
I'd like to use IPA but I'm not a linguistic expert. Is there an online tool I can use?,"Several standard dictionaries, such as the Oxford English Dictionary or the Cambridge Dictionary (including their online versions) provide pronunciations in IPA. There are also online converters (e.g. easypronunciation.com or tophonetics.com for English) ? however, note that in most cases these tools are based on underlying dictionaries and may not generate correct IPA for some words, such as proper names. Amazon Transcribe does not endorse any third-party tools."
Do I need to use different IPA standards that are specific to a different accents of the same language? (e.g. US English versus British English)?,"You should use the IPA standard that is appropriate for the audio files you will be processing ? e.g., if you are expecting to process audio from British English speakers, use the British English pronunciation standard. The set of allowed IPA symbols may differ for the different languages and dialects supported by Amazon Transcribe; please make sure that your pronunciations contain only the allowed characters. Details on the IPA character sets can be found in the documentation: https://docs.aws.amazon.com/transcribe/latest/dg/how-vocabulary.html#charsets"
How can I provide the pronunciation using SoundsLike field in the custom vocabulary table?,"You can break a word or phrase down into smaller pieces and provide a pronunciation for each piece using the standard orthography of the language to mimic the way that the word sounds. For example, in English you can provide pronunciation hints for the phrase Los-Angeles like this: loss-ann-gel-es. The hint for the word Etienne would look like this: eh-tee-en. You separate each part of the hint with a hyphen (-). You can use any of the allowed characters for the input language."
How do two different ways of providing acronyms (with periods and without periods but with pronunciations) work?,"If you use an acronym containing periods, the spelling pronunciation will be generated internally. If you do not use periods, please provide the pronunciation in the pronunciation field. For some acronyms, it is not obvious whether they have a spelling pronunciation or a word-like pronunciation (e.g., NATO is often pronounced ?n e? t o?? (nay-toh) rather than ??n e? ti o?? (N. A. T. O.))."
Where can I find examples of how to use custom pronunciations?,You can find sample input formats and examples in the documentation: https://docs.aws.amazon.com/transcribe/latest/dg/how-vocabulary.html.
"What happens if I use the wrong IPA? If I am uncertain, am I better off not inputting any IPA?","The system will use the pronunciation you provide; this should increase the likelihood of the word being recognized correctly if the pronunciation is correct and matches what was spoken. If you are not certain you are generating correct IPA, please run a comparison by processing your audio files with a vocabulary that contains your IPA pronunciations, and with a vocabulary that only contains the words (and, optionally, display-as forms). If you do not provide any pronunciations the service will use an approximation, which may or may not work better than your input."
"When using DisplayAs forms, can I display character sets unrelated to the original language being transcribed? (e.g. output ?Street? as ????).","Yes. While phrases may only use a restricted set of characters for the specific language, UTF-8 characters apart from \t (TAB) are permitted in the DisplayAs column."
Is Automatic content redaction available with both batch and streaming APIs for Transcribe?,"No, it is only available for batch APIs at this time."
What languages are supported for Automatic content redaction?,US-English (en-US) is supported at this time.
Does Automatic content redaction also redact sensitive personal information from the source audio?,"No, this feature does not remove sensitive personal information from the source audio. You can however redact personal information from the source audio yourself using the start and end timestamps that are provided in the redacted transcripts for each instance of an identified PII utterance."
Can I use Automatic content redaction for redacting personal information from the existing text transcripts?,"No, Automatic content redaction only works on audio file as an input."
What else should I know before using Automatic content redaction?,"Automatic content redaction is designed to identify and remove personally identifiable information (PII), but due to the predictive nature of machine learning, it may not identify and remove all instances of PII in a transcript generated by the service. You should review any output provided by Automatic content redaction to ensure it meets your needs."
What does it cost?,Refer to the Amazon Transcribe Pricing page to learn more.
What AWS regions are available for Amazon Transcribe?,Please refer to the AWS Global Infrastructure Region Table.
