"Are voice inputs processed by Amazon Transcribe stored, and how are they used by AWS?","Amazon Transcribe may store and use voice inputs processed by the service solely to provide and maintain the service and to improve and develop the quality of Amazon Transcribe and other Amazon machine-learning/artificial-intelligence?technologies. Use of your content is important for continuous improvement of your Amazon Transcribe customer experience, including the development and training of related technologies. We do not use any personally identifiable information that may be contained in your content to target products, services, or marketing to you or your end users. Your trust, privacy, and the security of your content are our highest priority, and we implement appropriate and sophisticated technical and physical controls, including encryption at rest and in transit, designed to prevent unauthorized access to, or disclosure of, your content and ensure that our use complies with our commitments to you. Please see https://aws.amazon.com/compliance/data-privacy-faq/ for more information.?You may opt out of having your content used to improve and develop the quality of Amazon Transcribe and other Amazon machine-learning/artificial-intelligence technologies by contacting AWS Support."
Can I delete data and artifacts associated with transcription jobs stored by Amazon Transcribe?,"Yes. You can use available Delete APIs to delete data and other artifacts associated with transcription jobs. If you have issues doing so, contact AWS support."
Who has access to my content that is processed and stored by Amazon Transcribe?,"Only authorized employees will have access to your content that is processed by Amazon Transcribe. Your trust, privacy, and the security of your content are our highest priority, and we implement appropriate and sophisticated technical and physical controls, including encryption at rest and in transit, designed to prevent unauthorized access to, or disclosure of, your content and ensure that our use complies with our commitments to you. Please see https://aws.amazon.com/compliance/data-privacy-faq/ for more information."
Do I still own my content that is processed and stored by Amazon Transcribe?,"You always retain ownership of your content, and we will only use your content with your consent."
Is the content processed by Amazon Transcribe moved outside the AWS region where I am using Amazon Transcribe?,"Any content processed by Amazon Transcribe is encrypted and stored at rest in the AWS region where you are using Amazon Transcribe. Some portion of content processed by Amazon Transcribe may be stored in another AWS region solely in connection with the continuous improvement and development of your Amazon Transcribe customer experience and other Amazon machine-learning/artificial-intelligence technologies. If you opt out of having your content used to develop the quality of Amazon Transcribe and other Amazon machine-learning/artificial-intelligence technologies by contacting AWS Support, your content will not be stored in another AWS region. You can request deletion of voice inputs associated with your account by contacting AWS Support. Your trust, privacy, and the security of your content are our highest priority and we implement appropriate and sophisticated technical and physical controls, including encryption at rest and in transit, designed to prevent unauthorized access to, or disclosure of, your content and ensure that our use complies with our commitments to you. Please see https://aws.amazon.com/compliance/data-privacy-faq/ for more information."
"Can I use Amazon Transcribe in connection with websites, programs or other applications that are directed or targeted to children under age 13 and subject to the Children?s Online Privacy Protection Act (COPPA)?","Yes, subject to your compliance with the Amazon Transcribe Service Terms, including your obligation to provide any required notices and obtain any required verifiable parental consent under COPPA, you may use Amazon Transcribe in connection with websites, programs, or other applications that are directed or targeted, in whole or in part, to children under age 13."
"How do I determine whether my website, program, or application is subject to COPPA?","For information about the requirements of COPPA and guidance for determining whether your website, program, or other application is subject to COPPA, please refer directly to the resources provided and maintained by the United States Federal Trade Commission. This site also contains information regarding how to determine whether a service is directed or targeted, in whole or in part, to children under age 13."
What is Amazon Transcribe Medical?,"Amazon Transcribe Medical is an automatic speech recognition (ASR) service that makes it easy for developers to add medical speech-to-text capabilities to their applications. Using Amazon Transcribe Medical, you can quickly and accurately transcribe medical dictation and conversational speech into text for a variety of purposes, such as recording physician notes or processing in downstream text analytics to extract meaningful insights."
What can I do with Amazon Transcribe Medical?,"Amazon Transcribe Medical uses advanced machine learning models to accurately transcribe medical speech into text. Transcribe Medical can general text transcripts that can be used to support a variety of use cases, spanning clinical documentation workflow and drug safety monitoring (pharmacovigilance) to subtitling for telemedicine and even contact center analytics in the healthcare and life sciences domains."
Do I need to be an expert in automatic speech recognition (ASR) to use Amazon Transcribe Medical?,"No, you don?t need any ASR or machine learning expertise to use Amazon Transcribe Medical. You only need to call Transcribe Medical?s API, and the service will handle the required machine learning in the backend to transcribe medical speech to text."
How do I get started with Amazon Transcribe Medical?,You can get started with Amazon Transcribe Medical from the AWS Management console or by using the SDK. Please refer to this technical documentation page for details. Amazon Transcribe Medical provides a free tier so that you can test the service. Refer to this pricing page for more information.
Which languages does Amazon Transcribe Medical support?,Amazon Transcribe Medical currently supports medical transcription in US English.
Which medical specialties does Amazon Transcribe Medical support?,"Amazon Transcribe Medical supports transcription for primary care, covering specialties such as family medicine, internal medicine, pediatrics, and OB-GYN."
In which AWS regions is Amazon Transcribe Medical available?,"Amazon Transcribe Medical is currently available in US-East (N. Virginia), US East (Ohio), US West (Oregon), Canada (Central), EU (Ireland), and Asia Pacific (Sydney)."
How is Amazon Transcribe Medical priced?,Refer to the Amazon Transcribe Medical pricing page to learn more about pricing details.
Is Amazon Transcribe Medical HIPAA eligible?,Yes.
Is the content processed by Amazon Transcribe Medical used for any purpose other than to provide the service?,Amazon Transcribe Medical does not use content processed by the service for any reason other than to provide and maintain the service. Content processed by the service is not used to develop or improve the quality for Amazon Transcribe Medical or any other Amazon machine-learning/artificial-intelligence technologies.
Does Amazon Transcribe Medical learn over time?,"Yes, Amazon Transcribe Medical uses machine learning and is continuously being trained to make it better for customer use cases. Amazon Transcribe medical does not store or use customer data used with the service to train the models"
What else should I know before using the Amazon Transcribe Medical service?,"Amazon Transcribe Medical is not a substitute for professional medical advice, diagnosis, or treatment. You and your end users are responsible for exercising your and their own discretion, experience, and judgment in determining the correctness, completeness, timeliness, and suitability of any information provided by Amazon Transcribe Medical. You and your end users are solely responsible for any decisions, advice, actions, and/or inactions based on the use of Amazon Transcribe Medical. You are responsible for reviewing any output provided by Amazon Transcribe Medical to ensure it meets your needs."
What is Amazon Rekognition?,"Amazon Rekognition is a service that makes it easy to add powerful visual analysis to your applications. Rekognition Image lets you easily build powerful applications to search, verify, and organize millions of images. Rekognition Video lets you extract motion-based context from stored or live stream videos and helps you analyze them. Rekognition Image is an image recognition service that detects objects, scenes, and faces; extracts text; recognizes celebrities; and identifies inappropriate content in images. It also allows you to search and compare faces. Rekognition Image is based on the same proven, highly scalable, deep learning technology developed by Amazon?s computer vision scientists to analyze billions of images daily for Prime Photos.

Rekognition Image uses deep neural network models to detect and label thousands of objects and scenes in your images, and we are continually adding new labels and facial recognition features to the service. With Rekognition Image, you only pay for the images you analyze and the face metadata you store.

Rekognition Video is a video recognition service that detects activities; understands the movement of people in frame; and recognizes objects, celebrities, and inappropriate content in videos stored in Amazon S3 and live video streams from Acuity. Rekognition Video detects persons and tracks them through the video even when their faces are not visible, or as the whole person might go in and out of the scene. For example, this could be used in an application that sends a real-time notification when someone delivers a package to your door. Rekognition Video allows you also to index metadata like objects, activities, scene, celebrities, and faces that make video search easy."
What is deep learning?,"Deep learning is a sub-field of Machine Learning and a significant branch of Artificial Intelligence. It aims to infer high-level abstractions from raw data by using a deep graph with multiple processing layers composed of multiple linear and non-linear transformations. Deep learning is loosely based on models of information processing and communication in the brain. Deep learning replaces handcrafted features with ones learned from very large amounts of annotated data. Learning occurs by iteratively estimating hundreds of thousands of parameters in the deep graph with efficient algorithms. Several deep learning architectures such as convolutional deep neural networks (CNNs), and recurrent neural networks have been applied to computer vision, speech recognition, natural language processing, and audio recognition to produce state-of-the-art results on various tasks.

Amazon Rekognition is a part of the Amazon AI family of services. Amazon AI services use deep learning to understand images, turn text into lifelike speech, and build intuitive conversational text and speech interfaces."
Do I need any deep learning expertise to use Amazon Rekognition?,"No. With Amazon Rekognition, you don?t have to build, maintain or upgrade deep learning pipelines. To achieve accurate results on complex computer vision tasks such as object and scene detection, face analysis, and face recognition, deep learning systems need to be tuned properly and trained with massive amounts of labeled ground truth data. Sourcing, cleaning, and labeling data accurately is a time-consuming and expensive task. Moreover, training a deep neural network is computationally expensive and often requires custom hardware built using Graphics Processing Units (GPU).

Amazon Rekognition is fully managed and comes pre-trained for image and video recognition tasks, so that you don?t have invest your time and resources on creating a deep learning pipeline. Amazon Rekognition continues to improve the accuracy of its models by building upon the latest research and sourcing new training data. This allows you to focus on high-value application design and development."
What are the most common use cases for Amazon Rekognition?,"The most common use-cases for Rekognition Image include: 
    Searchable Image Library
    Face-Based User Verification
    Sentiment Analysis
    Facial Recognition
    Image Moderation

The most common use-cases for Rekognition Video include:

    Search Index for video archives
    Easy filtering of video for explicit and suggestive content
"
How do I get started with Amazon Rekognition?,"If you are not already signed up for Amazon Rekognition, you can click the ""Try Amazon Rekognition"" button on the Amazon Rekognition page and complete the sign-up process. You must have an Amazon Web Services account; if you do not already have one, you will be prompted to create one during the sign-up process. Once you are signed up, try out Amazon Rekognition with your own images and videos using the Amazon Rekognition Management Console or download the Amazon Rekognition SDKs to start creating your own applications. Please refer to our step-by-step Getting Started Guide for more information."
What APIs does Amazon Rekognition offer??,"Amazon Rekognition Image offers APIs to detect objects and scenes, detect and analyze faces, recognize celebrities, detect inappropriate content, and search for similar faces in a collection of faces, along with APIs to manage resources. Rekognition Image also offers APIs to compare faces and extract text, while Rekognition Video also offers APIs to track persons and manage live stream video from Acuity. For details, please refer to the Amazon Rekognition API Reference."
What image and video formats does Amazon Rekognition support??,"Amazon Rekognition Image currently supports the JPEG and PNG image formats. You can submit images either as an S3 object or as a byte array. Amazon Rekognition Video operations can analyze videos stored in Amazon S3 buckets. The video must be encoded using the H.264 codec. The supported file formats are MPEG-4 and MOV. A codec is software or hardware that compresses data for faster delivery and decompresses received data into its original form. The H.264 codec is commonly used for the recording, compression and distribution of video content. A video file format may contain one or more codecs. If your MOV or MPEG-4 format video file does not work with Rekognition Video, check that the codec used to encode the video is H.264."
What file sizes can I use with Amazon Rekognition??,"Amazon Rekognition Image supports image file sizes up to 15MB when passed as an S3 object, and up to 5MB when submitted as an image byte array. Amazon Rekognition Video supports up to 10 GB files and up to 6 hour videos when passed through as an S3 file."
How does image resolution affect the quality of Rekognition Image API results ??,"Amazon Rekognition works across a wide range of image resolutions. For best results we recommend using VGA (640x480) resolution or higher. Going below QVGA (320x240) may increase the chances of missing faces, objects, or inappropriate content; although Amazon Rekognition accepts images that are at least 80 pixels in both dimensions."
How small can an object be for Amazon Rekognition Image to detect and analyze it?,"As a rule of thumb, please ensure that the smallest object or face present in the image is at least 5% of the size (in pixels) of the shorter image dimension. For example, if you are working with a 1600x900 image, the smallest face or object should be at least 45 pixels in either dimension."
How can I get Amazon Rekognition predictions reviewed by humans?,"Amazon Rekognition is directly integrated with Amazon Augmented AI (Amazon A2I) so you can easily route low confidence predictions from Amazon Rekognition Image to human reviewers. Using the Amazon Rekognition API for content moderation or the Amazon A2I console, you can specify the conditions under which Amazon A2I routes predictions to reviewers, which can be either a confidence threshold or a random sampling percentage. If you specify a confidence threshold, Amazon A2I routes only those predictions that fall below the threshold for human review. You can adjust these thresholds at any time to achieve the right balance between accuracy and cost-effectiveness. Alternatively, if you specify a sampling percentage, Amazon A2I routes a random sample of the predictions for human review. This can help you implement audits to monitor the prediction accuracy regularly. Amazon A2I also provides reviewers with a web interface consisting of all the instructions and tools they need to complete their review tasks. For more information about implementing human review with Amazon Rekognition, see the Amazon A2I webpage."
How does video resolution affect the quality of Rekognition Video API? results??,"The system is trained to recognize faces larger than 32 pixels (on the shortest dimension), which translate into a minimum size for a face to be recognized that varies from approximately 1/7 of the screen smaller dimension at QVGA resolution to 1/30 at HD 1080p resolution. For example, at VGA resolution, users should expect lower performances for faces smaller than 1/10 of the screen smaller dimension."
What else can affect the quality of the Rekognition Video APIs ??,"Besides video resolution, heavy blur, fast moving persons, lighting conditions, pose may affect the quality of the APIs."
What is the preferred user video content that is suitable for Rekognition Video APIs??,"This API works best with consumer and professional videos taken with frontal field of view in normal color and lighting conditions. This API is not tested for black and white, IR or extreme lighting condition. Applications that are sensitive to false alarms are advised to discard outputs with confidence score below a selected (application-specific) confidence score."
In which AWS regions is Amazon Rekognition available??,"For a list of all regions where Amazon Rekognition is available, see the AWS Region table."
What is a label?,"A label is an object, scene, or concept found in an image based on its contents. For example, a photo of people on a tropical beach may contain labels such as ?Person?, ?Water?, ?Sand?, ?Palm Tree?, and ?Swimwear? (objects), ?Beach? (scene), and ?Outdoors? (concept).?"
What is a confidence score and how do I use it?,"A confidence score is a number between 0 and 100 that indicates the probability that a given prediction is correct. In the tropical beach example, if the object and scene detection process returns a confidence score of 99 for the label ?Water? and 35 for the label ?Palm Tree?, then it is more likely that the image contains water but not a palm tree. Applications that are very sensitive to detection errors (false positives) should discard results associated with confidence scores below a certain threshold. The optimum threshold depends on the application. In many cases, you will get the best user experience by setting minimum confidence values higher than the default value."
What is Object and Scene Detection?,"Object and Scene Detection refers to the process of analyzing an image or video to assign labels based on its visual content. Amazon Rekognition Image does this through the DetectLabels API. This API lets you automatically identify thousands of objects, scenes, and concepts and returns a confidence score for each label. DetectLabels uses a default confidence threshold of 50. Object and Scene detection is ideal for customers who want to search and organize large image libraries, including consumer and lifestyle applications that depend on user-generated content and ad tech companies looking to improve their targeting algorithms."
Can Amazon Rekognition detect object locations and return bounding boxes?,"Yes, Amazon Rekognition can detect the location of many common objects such as ?Person?, ?Car?, ?Gun?, or ?Dog? in both images and videos. You get the coordinates of the bounding rectangle for each instance of the object found, as well as a confidence score. For more details on the API response structure for object bounding boxes, please refer to the documentation."
Does Amazon Rekognition provide information on the relationship between detected labels?,"Yes, for every label found, Amazon Rekognition returns the parent labels if they exist. Parents are returned in hierarchical order - the leftmost label is the immediate parent or synonym, while following labels are parents of parents. For example, when a ?Car? is identified, Amazon Rekognition returns two parent labels ?Vehicle? (parent), and ?Transportation? (parent?s parent). For more details on how to use hierarchical taxonomy relations, please refer to the documentation."
What types of labels does Amazon Rekognition support? ?,"Rekognition supports thousands of labels belonging to common categories including, but not limited to:People and Events: ?Wedding?, ?Bride?, ?Baby?, ?Birthday Cake?, ?Guitarist?, etc.
Food and Drink: ?Apple?, ?Sandwich?, ?Wine?, ?Cake?, ?Pizza?, etc.
Nature and Outdoors: ?Beach?, ?Mountains?, ?Lake?, ?Sunset?, ?Rainbow?, etc.
Animals and Pets: ?Dog?, ?Cat?, ?Horse?, ?Tiger?, ?Turtle?, etc.
Home and Garden: ?Bed?, ?Table?, ?Backyard?, ?Chandelier?, ?Bedroom?, etc.
Sports and Leisure: ?Golf?, ?Basketball?, ?Hockey?, ?Tennis?, ?Hiking?, etc.
Plants and Flowers: ?Rose?, ?Tulip?, ?Palm Tree?, ?Forest?, ?Bamboo?, etc.
Art and Entertainment: ?Sculpture?, ?Painting?, ?Guitar?, ?Ballet?, ?Mosaic?, etc.
Transportation and Vehicles: ?Airplane?, ?Car?, ?Bicycle?, ?Motorcycle?, ?Truck?, etc.
Electronics: ?Computer?, ?Mobile Phone?, ?Video Camera?, ?TV?, ?Headphones?, etc."
How is Object and Scene Detection different for video analysis?,"Rekognition Video enables you to automatically identify thousands of objects - such as vehicles or pets - and activities - such as celebrating or dancing - and provides you with timestamps and a confidence score for each label. It also relies on motion and time context in the video to accurately identify complex activities, such as ?blowing a candle? or ?extinguishing fire?."
I can?t find the label I need. How do I request a new label?,Please send us your requests through AWS Customer Support. Amazon Rekognition continuously expands its catalog of labels based on customer feedback
How can you check if Amazon Rekognition has updated its models?,Amazon Rekognition returns a LabelModelVersion parameter that lets you know whether the model has been updated. Object and Scene detection models are updated frequently based on customer feedback.
"Can I use Custom Labels for analyzing faces, customized text detection, or finding unsafe image content?","No. Custom Labels is meant for finding objects and scenes in images. Custom Labels is not designed for analyzing faces, customized text detection, or finding unsafe image content. You should use other Rekognition APIs for these tasks. Please refer to the documentation for face analysis, Text detection, and Moderation."
How many images are needed to train a custom model?,"The number of images required to train a custom model depends on the variability of the custom labels you want the model to predict and the quality of the training data. For example, a distinct logo overlaid on an image can be detected with 1-2 training images, while a more subtle logo required to be detected under many variations (scale, viewpoint, deformations) may need in the order of tens to hundreds of training examples with high quality annotations. If you already have a high number of labeled images, we recommend training a model with as many images as you have available. Please refer to the documentation for limits on maximum training dataset size. Although hundreds of images may sometimes be required to train a custom model with high accuracy, with Custom Labels you can first train a model with tens of images per label, review your test results to understand where it does not work, and accordingly add new training images and train again to iteratively improve your model."
How many inference compute resources should I provision for my custom model?,"The number of parallel inference compute resources needed depends on how many images you need to process at a given point in time. The throughput of a single resource will depend factors including the size of the images, the complexity of those images (how many detected objects are visible), and the complexity of your custom model. We recommend that you monitor the frequency at which you need provision your custom model, and the number of images that need to be processed at a single time, in order to schedule provisioning of your custom model most efficiently. If you expect to process images periodically (e.g. once a day or week, or scheduled times during the day), you should Start provisioning your custom model at a scheduled time, process all your images, and then Stop provisioning. If you don?t stop provisioning, you will be charged even if no images are processed."
My training has failed. Will I be charged?,No. You will not be charged for the compute resources if your training fails.
